{
  "artifacts": {
    "historical_evidence": "sim/reference/mutation-runtime-v1.json, the three family publications, the matrix publication and DR-0006 records are preserved unchanged; the campaign publishes under a new name",
    "retained_per_attempt": [
      "raw audio slot file and the full batch audio bytes",
      "every captured trace file named by the registry",
      "events (ordered, in-band) with original and replacement slot digests",
      "capture inventory and invocation counts",
      "plan, schedule and detector input/rows",
      "worker stderr and exit status"
    ],
    "retained_per_run": [
      "worker.json",
      "build log and its sha256",
      "docker image id and layers",
      "host fingerprint (Q1 record fields)",
      "project_git commit, dirty flag, diff and untracked digests",
      "this manifest's revision and frozen digest",
      "the attempt inventory with the expected denominator"
    ],
    "storage_rule": "fresh output directory only; existing experiments are preserved; raw files are never regenerated to clear a failure"
  },
  "authority_questions": [
    {
      "id": "AQ-1",
      "interim": "deferred_unmeasured; obligation stays open",
      "question": "May the pinned torchsynth AudioMixer.output be given a scoped observer/replacement hook (or the release image patched) so normalization decisions are injectable?",
      "why_routed": "it contradicts the accepted framework rule that producer and render-path modules are read-only inputs (spec/MUTATIONS.md) and touches the pinned upstream source"
    },
    {
      "id": "AQ-2",
      "interim": "not_admitted; Q1-Q6 preregistered",
      "question": "Is the AWS box i-018841ef4169207ba to be admitted as an additional DR-0006 host, and under what scope?",
      "why_routed": "DR-0006 limits full-matrix qualification to its measured Apple host and requires a reviewed decision record for any host change"
    },
    {
      "id": "AQ-3",
      "interim": "proposed_additions entry; not in the denominator",
      "question": "Do the decision owners accept registering the literal interp.align_corners_false operator in the timing family (requalification of that family)?",
      "why_routed": "adding an operator changes the family registry and the frozen denominator"
    }
  ],
  "cases": [
    {
      "batch_block": 0,
      "batch_size": 32,
      "batch_slot": 0,
      "global_sound_index": 0,
      "id": "global-0",
      "partition": "development"
    },
    {
      "batch_block": 0,
      "batch_size": 32,
      "batch_slot": 31,
      "global_sound_index": 31,
      "id": "global-31",
      "partition": "development"
    },
    {
      "batch_block": 1,
      "batch_size": 32,
      "batch_slot": 0,
      "global_sound_index": 32,
      "id": "global-32",
      "partition": "development"
    }
  ],
  "completion": {
    "campaign_complete_requires": [
      "host admitted under the Q1-Q6 predicate",
      "every runtime_cell and composition cell executed in each of its own repeats_required (never fewer than the ratified minimum) with a passing per-execution result",
      "all expected refusals observed as refused",
      "all controls passed",
      "offline verifier PASS",
      "no extra, missing or duplicate attempt"
    ],
    "closure_rule": "completing this manifest closes only its stated scope; #300 and #9 stay open while any open obligation above is unresolved or not waived by the decision owners",
    "never_counts_toward_runtime_kills": [
      "refusal",
      "sensitivity_not_counted",
      "ineffective event",
      "deferred_unmeasured",
      "second_detector without its shared cell",
      "composition (reported separately)",
      "boundary_runtime in graph-perturbation totals (reported separately)",
      "any synthetic fixture or bridge.* proof",
      "admissibility refusal (refused_inadmissible_not_counted) of any gated detector or second_detector"
    ],
    "open_obligations_after_completion": [
      "normalization decision injection (deferred; #300/#9 criteria stay open)",
      "LFO amplitude-depth fault (timing:lfo-depth-shift-plus-0.1) realization at a writable output seam (deferred; #300/#9 criteria stay open)",
      "literal align_corners operator registration and execution (proposed addition)",
      "#297/#298 additions (declared revision)",
      "six #297 publication faults registered deferred_unmeasured by revision 2 (DR-0014): decay/release breakpoint, sustain, -1 dB gain, truncation and the truncation-vs-rounding directed distinction"
    ],
    "status_values": [
      "COMPLETE",
      "INCOMPLETE",
      "NO_VERDICT",
      "FAIL"
    ]
  },
  "controls": [
    {
      "expected_event": "none",
      "id": "plain",
      "kind": "plain",
      "must": "detectors PASS on the clean attempt; equals the committed sentinel for global-0 batch 32",
      "per": "case_repeat"
    },
    {
      "expected_event": "none",
      "id": "empty",
      "kind": "empty_plan",
      "must": "byte-identical to plain; zero events",
      "per": "case_repeat"
    },
    {
      "expected_event": "ineffective",
      "id": "sham",
      "kind": "sham_plan",
      "must": "byte-identical to plain; event marked sham and ineffective; never counted as a detected fault",
      "per": "case_repeat"
    },
    {
      "expected_event": "none",
      "id": "clean_rerun",
      "kind": "clean_rerun",
      "must": "after all faulted attempts in the process, byte-identical to plain (cleanup)",
      "per": "case_repeat"
    }
  ],
  "decision_record": "spec/decision-records/0012-runtime-family-campaign-contract.md",
  "detectors": [
    {
      "detector": "identity.SoundIdentity.to_dict recomputation at the declared render batch size",
      "family": "identity",
      "id": "det-identity-01",
      "qualification_scope": "exact_recomputation"
    },
    {
      "detector": "identity.SoundIdentity.is_train recomputation",
      "family": "identity",
      "id": "det-identity-02",
      "qualification_scope": "exact_recomputation"
    },
    {
      "detector": "directed.physical_value pinned-conversion recomputation (the name-keyed interface accepts the shuffle; the conversion recomputation is the refusal)",
      "family": "identity",
      "id": "det-identity-03",
      "qualification_scope": "exact_recomputation"
    },
    {
      "detector": "directed.physical_value pinned-conversion recomputation",
      "family": "identity",
      "id": "det-identity-04",
      "qualification_scope": "exact_recomputation"
    },
    {
      "detector": "spectral_estimators.noise_identity exact record comparison + float_interfaces.ResolvedRequest diagnostic-batch-1 slot-copy refusal",
      "family": "identity",
      "id": "det-identity-05",
      "qualification_scope": "exact_recomputation"
    },
    {
      "detector": "float_interfaces.ResolvedRequest declared-seed refusal + spectral_estimators.noise_identity exact record comparison",
      "family": "identity",
      "id": "det-identity-06",
      "qualification_scope": "exact_recomputation"
    },
    {
      "detector": "in-band declared-order events + spectral_estimators.noise_identity",
      "family": "identity",
      "id": "det-identity-07",
      "qualification_scope": "exact_recomputation"
    },
    {
      "detector": "envelope_estimators.estimate_envelope + qualification_rows (attack_end)",
      "family": "timing",
      "id": "det-timing-01",
      "qualification_scope": "analytic_signals_only"
    },
    {
      "detector": "paired_metrics time-locked primary row (analytic exactness rubric)",
      "family": "timing",
      "id": "det-timing-02",
      "qualification_scope": "paired_reference_exact"
    },
    {
      "detector": "mutations_timing.frame_preflight + compare_paired frame gate",
      "family": "timing",
      "id": "det-timing-03",
      "qualification_scope": "plan_or_preflight_refusal"
    },
    {
      "detector": "periodic_estimators.score_periodic against the committed sim/qualification/periodic-v1.json range cell",
      "family": "timing",
      "id": "det-timing-04",
      "qualification_scope": "analytic_signals_only"
    },
    {
      "detector": "envelope_estimators.estimate_routes + qualification_rows (gain.",
      "family": "timing",
      "id": "det-timing-05",
      "qualification_scope": "analytic_signals_only"
    },
    {
      "detector": "paired_metrics time-locked primary row (analytic exactness rubric); source lane and parameter-map digest equality",
      "family": "timing",
      "id": "det-timing-06",
      "qualification_scope": "paired_reference_exact"
    },
    {
      "detector": "trace_capture.check_endpoint_bytes + paired exactness row",
      "family": "timing",
      "id": "det-timing-07",
      "qualification_scope": "paired_reference_exact"
    },
    {
      "detector": "in-band declared-order events + paired exactness row",
      "family": "timing",
      "id": "det-timing-08",
      "qualification_scope": "paired_reference_exact"
    },
    {
      "detector": "paired exactness contract rows (framing_match/exact_equal/max_abs_error/mean_error <= 1e-9, amplitude-exact, preparation none)",
      "family": "signal",
      "id": "det-signal-01",
      "qualification_scope": "paired_reference_exact"
    },
    {
      "detector": "periodic.cents analytic property row (identity preparation, no normalization)",
      "family": "signal",
      "id": "det-signal-02",
      "qualification_scope": "analytic_signals_only"
    },
    {
      "detector": "periodic.phase_rad analytic property row (identity preparation, no normalization)",
      "family": "signal",
      "id": "det-signal-03",
      "qualification_scope": "analytic_signals_only"
    },
    {
      "detector": "spectral normalization contract rows (decision_match/rule_error_max/reciprocal_error/reported_peak_error) over below/at/above-one fixtures; forced division must fail the bypass decision and byte-preservation rows",